{
  "schema": "piton.project.v1",
  "canonicalization": "piton.canonical-json.v1",
  "project_id": "minimal-bracket",
  "units": "mm",
  "authority": {
    "writable": "source-native-python",
    "entrypoint": "source/part.py",
    "dependency_lock": "locks/dependencies.lock",
    "toolchain_lock": "locks/toolchain.lock"
  },
  "source_files": [
    {
      "path": "source/part.py",
      "digest": "sha256:8257dd6b7efbe60205b837d2f88b197411c5ce03743ef7ab37354be4b84accbc",
      "media_type": "text/x-python",
      "line_endings": "lf"
    },
    {
      "path": "locks/dependencies.lock",
      "digest": "sha256:f651aafaed37274f942dab7cfb88e4e02276b41cdff7a72dd13fa11c18311367",
      "media_type": "text/plain",
      "line_endings": "lf"
    },
    {
      "path": "locks/toolchain.lock",
      "digest": "sha256:e6861dee3a983af0a66291fe6438c648728af89e2bde9bb023d2a42f71452dbc",
      "media_type": "text/plain",
      "line_endings": "lf"
    }
  ],
  "records": [
    {
      "record_id": "design.parameters",
      "kind": "piton.parameter-set/v1",
      "payload": {
        "height": "10 mm",
        "width": "20 mm"
      }
    },
    {
      "record_id": "design.intent",
      "kind": "piton.design-intent/v1",
      "payload": {
        "description": "Minimal review-only bracket"
      }
    }
  ],
  "safety": {
    "review_state": "needs_human_review",
    "fabrication_release": false,
    "machine_actuation": false
  }
}
